{
  "schemaVersion": 2,
  "id": "home-wide",
  "name": "Home Wide",
  "deviceTypeId": "home-screen",
  "renderer": "home",
  "columns": 1,
  "itemDefaults": {
    "columns": 1,
    "shape": "rounded",
    "cornerRadius": 14,
    "iconSize": 64,
    "fontSize": 16,
    "typeFontSize": 12,
    "stateFontSize": 11,
    "stateIconSize": 14,
    "stateLabelFontSize": 12,
    "stateValueFontSize": 12,
    "stateButtonFontSize": 11,
    "showIcon": true,
    "showName": true,
    "showType": true,
    "showState": true
  }
}
